{
  "baslik": "Pipeline Sonucu: 5 Siparis, 3 Parti — 2 Termin Uyarisi",
  "govde_md": "Bu kosuda 5 siparis 3 partiye dagitildi; toplam fiyat onerisi 3.400,00 USD olarak hesaplandi. **Dikkat:** 2 siparisde termin asimi tespit edildi (ORD-FORD-A2: 3 gun gecikme, ORD-BAYKAR-B1: 1 gun gecikme). B001 partisinin nesting yuksekligi 220.5 mm, doluluk %68.1 olarak gerceklesti. Termin asimlarinin musteri ile ivedilikle gorusiilmesi onerilir.",
  "kullanilan_kaynaklar": ["yerlesim#B001", "termin#cizelge", "fiyat#B001"],
  "eksik_bilgi": []
}
